{
  "$schema": "https://json-schema.org/draft/2020-12/schema",
  "$id": "https://agent-extension.org/schema/agent-extension-0.5.json",
  "title": "Agent Extension Protocol (AXP) manifest",
  "description": "Draft v0.5 (a valid v0.3 manifest is a valid v0.5 manifest). Runtime-neutral description of a packaged agent capability, plus per-runtime install recipes, updates, channels and ed25519 signing. Forward-compatibility rule (SPEC §2.4): unknown fields and unknown provides/component_map types are permitted and MUST be ignored by hosts, except closed permission-key and lifecycle-hook vocabularies; security-relevant enums are closed.",
  "type": "object",
  "required": ["spec_version", "kind", "identity", "provides", "targets"],
  "additionalProperties": true,
  "$defs": {
    "sha256": { "type": "string", "pattern": "^[a-fA-F0-9]{64}$" },
    "httpsUrl": { "type": "string", "pattern": "^https://" },
    "relPath": { "type": "string", "pattern": "^(?!/)(?!.*(^|/)\\.\\.(/|$)).+" },
    "endpointAuth": {
      "type": "object",
      "required": ["scheme"],
      "description": "How a client authenticates at an http/sse MCP server or a service endpoint (SPEC 4.2, Endpoint access)",
      "properties": {
        "scheme": { "type": "string", "description": "bearer = Authorization: Bearer <token>; an unknown scheme is ignored (2.4)" },
        "token_file": { "type": "string", "pattern": "^state:(?!/)(?!.*(^|/)\\.\\.(/|$)).+", "description": "state:<relative path> below AXP_STATE_DIR holding the token; created by the extension, never shipped" }
      }
    },
    "ed25519Key": { "type": "string", "pattern": "^ed25519:[A-Za-z0-9+/]{43}=$", "description": "base64 of the 32 raw public-key bytes" },
    "versionRange": { "type": "string", "pattern": "^(\\s*(>=|<=|>|<|=|\\^|~)?[0-9]+(\\.[0-9A-Za-z-]+)*\\s*)+$" },
    "namedComponent": {
      "type": "object",
      "required": ["name"],
      "additionalProperties": true,
      "properties": {
        "name": { "type": "string", "minLength": 1 },
        "summary": { "type": "string" }
      }
    }
  },
  "properties": {
    "spec_version": { "type": "string", "pattern": "^0\\.[0-9]+$", "description": "MAJOR.MINOR; this schema describes 0.5" },
    "kind": { "type": "string", "const": "agent-extension" },

    "identity": {
      "type": "object",
      "required": ["publisher", "name", "version", "display_name", "description"],
      "additionalProperties": true,
      "properties": {
        "publisher": { "type": "string", "pattern": "^[a-z0-9]([a-z0-9-]*[a-z0-9])?(\\.[a-z0-9]([a-z0-9-]*[a-z0-9])?)+$", "description": "DNS name; namespace of the extension id <publisher>/<name>" },
        "name": { "type": "string", "pattern": "^[a-z0-9][a-z0-9_-]*$", "maxLength": 64 },
        "version": { "type": "string", "pattern": "^[0-9]+\\.[0-9]+\\.[0-9]+(?:[-+].+)?$" },
        "display_name": { "type": "string", "minLength": 1 },
        "description": { "type": "string", "minLength": 1 },
        "author": { "type": "string" },
        "license": { "type": "string" },
        "homepage": { "$ref": "#/$defs/httpsUrl" },
        "keywords": { "type": "array", "items": { "type": "string" } },
        "i18n": {
          "type": "object",
          "additionalProperties": {
            "type": "object",
            "properties": { "display_name": { "type": "string" }, "description": { "type": "string" } }
          }
        }
      }
    },

    "provides": {
      "type": "object",
      "additionalProperties": true,
      "properties": {
        "mcp_servers": {
          "type": "array",
          "items": {
            "allOf": [{ "$ref": "#/$defs/namedComponent" }],
            "required": ["name", "transport"],
            "properties": {
              "transport": { "type": "string", "enum": ["stdio", "http", "sse"] },
              "command_ref": { "$ref": "#/$defs/relPath" },
              "url": { "type": "string" },
              "auth": { "$ref": "#/$defs/endpointAuth" }
            }
          }
        },
        "tools": {
          "type": "array",
          "items": { "allOf": [{ "$ref": "#/$defs/namedComponent" }], "properties": { "input_schema_ref": { "$ref": "#/$defs/relPath" } } }
        },
        "services": {
          "type": "array",
          "items": {
            "allOf": [{ "$ref": "#/$defs/namedComponent" }],
            "required": ["name", "kind"],
            "properties": {
              "kind": { "type": "string", "enum": ["daemon", "oneshot", "sidecar"] },
              "endpoint": { "type": "string" },
              "auth": { "$ref": "#/$defs/endpointAuth" }
            }
          }
        },
        "panel_views": {
          "type": "array",
          "description": "Optional host-owned isolated HTTP/WebSocket views (SPEC 4.2.1). Semantic validation must additionally check unique names, service references and the referenced loopback origin; JSON Schema alone cannot resolve references by name.",
          "items": {
            "type": "object",
            "required": ["name", "title", "service", "path", "capabilities"],
            "additionalProperties": true,
            "properties": {
              "name": { "type": "string", "pattern": "^[a-z0-9][a-z0-9_-]*$(?![\\s\\S])", "maxLength": 64 },
              "title": { "type": "string", "pattern": "\\S" },
              "icon": { "type": "string", "pattern": "\\S", "description": "Host-interpreted icon hint, not executable markup or a fetched URL." },
              "service": { "type": "string", "pattern": "^[a-z0-9][a-z0-9_-]*$(?![\\s\\S])", "maxLength": 64 },
              "path": { "type": "string", "pattern": "^/(?!/)(?!.*//)(?!.*(?:^|/)\\.{1,2}(?:/|$))(?!\\.{1,2}(?:/|$))[A-Za-z0-9/._~!$&'()*+,;=:@-]*$(?![\\s\\S])", "description": "Unencoded ASCII URI path. No percent escapes, dot segments, repeated slash, query, fragment, backslash, whitespace or controls." },
              "capabilities": { "type": "array", "items": { "type": "string" }, "description": "Known: pin, fullscreen. Hosts ignore unknown strings." }
            }
          }
        },
        "settings_section": {
          "type": "object",
          "description": "Optional section of the extension's own in the host's settings (SPEC 4.2.2). Semantic validation must additionally reject control characters and check that views name declared panel_views.",
          "required": ["title", "summary"],
          "additionalProperties": true,
          "properties": {
            "title": { "type": "string", "pattern": "\\S", "maxLength": 60 },
            "summary": { "type": "string", "pattern": "\\S", "maxLength": 400, "description": "What the extension does for the user, in plain words; not how it works." },
            "icon": { "type": "string", "pattern": "\\S", "description": "Host-interpreted icon hint, not executable markup or a fetched URL." },
            "views": { "type": "array", "uniqueItems": true, "items": { "type": "string", "pattern": "^[a-z0-9][a-z0-9_-]*$(?![\\s\\S])", "maxLength": 64 }, "description": "Names of provides.panel_views entries the host offers from the section." },
            "localized": {
              "type": "object",
              "propertyNames": { "pattern": "^[A-Za-z]{2,3}(-[A-Za-z0-9]{2,8})*$(?![\\s\\S])" },
              "additionalProperties": {
                "type": "object",
                "anyOf": [{ "required": ["title"] }, { "required": ["summary"] }],
                "properties": {
                  "title": { "type": "string", "pattern": "\\S", "maxLength": 60 },
                  "summary": { "type": "string", "pattern": "\\S", "maxLength": 400 }
                }
              }
            }
          }
        },
        "memory": {
          "type": "array",
          "items": {
            "allOf": [{ "$ref": "#/$defs/namedComponent" }],
            "required": ["name", "kind"],
            "properties": {
              "kind": { "type": "string", "enum": ["graph", "vector", "kv", "relational"] },
              "schema_ref": { "$ref": "#/$defs/relPath" }
            }
          }
        },
        "skills": {
          "type": "array",
          "items": { "allOf": [{ "$ref": "#/$defs/namedComponent" }], "properties": { "path": { "$ref": "#/$defs/relPath" } } }
        },
        "prompts": {
          "type": "array",
          "items": { "allOf": [{ "$ref": "#/$defs/namedComponent" }], "properties": { "fragment_ref": { "$ref": "#/$defs/relPath" } } }
        },
        "persona": {
          "type": "array",
          "description": "v0.2 alias of prompts; read, never written by v0.3 publishers",
          "items": { "type": "object", "properties": { "fragment_ref": { "$ref": "#/$defs/relPath" } } }
        },
        "channels": { "type": "array", "items": { "$ref": "#/$defs/namedComponent" } },
        "model_providers": { "type": "array", "items": { "$ref": "#/$defs/namedComponent" } },
        "hooks": {
          "type": "array",
          "items": { "allOf": [{ "$ref": "#/$defs/namedComponent" }], "required": ["name", "event"], "properties": { "event": { "type": "string" } } }
        },
        "cron": {
          "type": "array",
          "items": { "allOf": [{ "$ref": "#/$defs/namedComponent" }], "required": ["name", "schedule"], "properties": { "schedule": { "type": "string" } } }
        },
        "config": {
          "type": "object",
          "properties": {
            "schema_ref": { "$ref": "#/$defs/relPath" },
            "secrets": { "type": "array", "items": { "type": "string" } }
          }
        }
      }
    },

    "requires": {
      "type": "object",
      "additionalProperties": true,
      "properties": {
        "extensions": {
          "type": "array",
          "items": {
            "type": "object",
            "required": ["id"],
            "properties": {
              "id": { "type": "string", "pattern": "^[a-z0-9.-]+/[a-z0-9][a-z0-9_-]*$" },
              "version": { "$ref": "#/$defs/versionRange" }
            }
          }
        },
        "resources": {
          "type": "object",
          "properties": {
            "disk_mb": { "type": "integer", "minimum": 0 },
            "ram_mb": { "type": "integer", "minimum": 0 }
          }
        },
        "commands": { "type": "array", "items": { "type": "string" } }
      }
    },

    "permissions": {
      "type": "object",
      "additionalProperties": false,
      "description": "Closed: an unknown permission key is a refusal, not an ignore (SPEC §2.4).",
      "properties": {
        "network_egress": { "type": "array", "items": { "type": "string", "pattern": "^(\\*|(\\*\\.)?[A-Za-z0-9][A-Za-z0-9.-]*)(:[0-9]{1,5})?$" }, "description": "host[:port]; *.example.com covers hosts under it; * (or *:443) is any host" },
        "network_ingress": { "type": "array", "items": { "type": "string", "pattern": "^([A-Za-z0-9.:\\[\\]-]+:)?[0-9]{1,5}/(tcp|udp)$" } },
        "filesystem": { "type": "array", "items": { "type": "string", "pattern": "^([a-z][a-z0-9_-]*:)?[a-z][a-z0-9_-]*:(r|rw)$" }, "description": "<scope>:<mode> or <runtime>:<scope>:<mode>" },
        "secrets": { "type": "array", "items": { "type": "string" } },
        "root": { "type": "boolean" },
        "reason": {
          "anyOf": [
            { "type": "string" },
            { "type": "object", "additionalProperties": { "type": "string" } }
          ]
        }
      }
    },

    "release": {
      "type": "object",
      "required": ["channel", "artifact"],
      "additionalProperties": true,
      "properties": {
        "channel": { "type": "string", "pattern": "^[a-z][a-z0-9_-]*$", "description": "Core dev|alpha|beta|stable, or a custom opaque channel name." },
        "published_at": { "type": "string", "format": "date-time" },
        "valid_until": { "type": "string", "format": "date-time" },
        "changelog": { "type": "string" },
        "artifact": {
          "type": "object",
          "required": ["url", "sha256"],
          "properties": {
            "url": { "$ref": "#/$defs/httpsUrl" },
            "sha256": { "$ref": "#/$defs/sha256" }
          }
        }
      }
    },

    "updates": {
      "type": "object",
      "required": ["source"],
      "additionalProperties": true,
      "properties": {
        "source": {
          "oneOf": [
            { "type": "object", "required": ["kind", "repo"], "properties": { "kind": { "const": "github" }, "repo": { "type": "string", "pattern": "^[^/\\s]+/[^/\\s]+$" } } },
            { "type": "object", "required": ["kind", "url", "repo"], "properties": { "kind": { "const": "forge" }, "url": { "$ref": "#/$defs/httpsUrl" }, "repo": { "type": "string" } } },
            { "type": "object", "required": ["kind", "url"], "properties": { "kind": { "const": "feed" }, "url": { "$ref": "#/$defs/httpsUrl" } } },
            { "type": "object", "required": ["kind", "url"], "properties": { "kind": { "const": "direct" }, "url": { "$ref": "#/$defs/httpsUrl" } } }
          ]
        },
        "check": { "type": "string", "enum": ["hourly", "daily", "weekly", "manual"] },
        "policy": { "type": "string", "enum": ["auto", "notify", "pin", "off"] }
      }
    },

    "signing": {
      "type": "object",
      "required": ["public_key"],
      "additionalProperties": true,
      "properties": {
        "public_key": { "$ref": "#/$defs/ed25519Key" },
        "key_id": { "type": "string" },
        "next_key": { "anyOf": [{ "type": "null" }, { "$ref": "#/$defs/ed25519Key" }] }
      }
    },
    "signature": { "type": "string", "description": "base64 ed25519 signature over the canonical (JCS) manifest with signature/signature_prev removed." },
    "signature_prev": { "type": "string", "description": "Present only on a key-rotation release: signature by the old pinned key." },

    "commerce": {
      "type": "object",
      "description": "Optional (SPEC 14): the extension is sold. AXP defines only the proof of purchase (a signed entitlement) and how a host checks it, never the payment. Plans are shown to the user, never computed with.",
      "required": ["entitlement"],
      "additionalProperties": true,
      "properties": {
        "entitlement": { "type": "string", "enum": ["required", "optional"], "description": "required = a host installs or enables only with a valid entitlement; optional = installs freely, an entitlement unlocks paid features inside the extension" },
        "plans": {
          "type": "array",
          "items": {
            "type": "object",
            "required": ["id", "kind"],
            "additionalProperties": true,
            "properties": {
              "id": { "type": "string", "pattern": "^[a-z0-9][a-z0-9_-]*$", "description": "what an entitlement's plan field names" },
              "kind": { "type": "string", "description": "one_time | subscription | trial; an unknown kind is shown as-is and not interpreted (2.4)" },
              "title": { "type": "string" },
              "price": {
                "type": "object",
                "required": ["amount", "currency"],
                "properties": {
                  "amount": { "type": "integer", "minimum": 0, "description": "minor units (500 = 5.00); JCS forbids floats" },
                  "currency": { "type": "string", "pattern": "^[A-Z]{3}$", "description": "ISO 4217" }
                }
              },
              "period": { "type": "string", "enum": ["month", "year"], "description": "subscription only (required there)" },
              "days": { "type": "integer", "minimum": 1, "description": "trial only (required there)" },
              "updates_months": { "type": "integer", "minimum": 0, "description": "one_time: how long new releases are covered (updates_until); absent = all updates" }
            }
          }
        },
        "checkout_url": { "$ref": "#/$defs/httpsUrl", "description": "where a host sends the user to buy; the host appends axp_extension, axp_holder and optionally axp_return (14.5)" },
        "refresh_url": { "$ref": "#/$defs/httpsUrl", "description": "issuer endpoint a host POSTs a presentation to for a new or renewed entitlement (14.5)" },
        "issuers": { "type": "array", "items": { "type": "string", "pattern": "^[a-z0-9]([a-z0-9-]*[a-z0-9])?(\\.[a-z0-9]([a-z0-9-]*[a-z0-9])?)+$" }, "description": "DNS names whose key directories (role entitlement) may sign entitlements for this extension; default: the publisher" },
        "grace_days": { "type": "integer", "minimum": 0, "description": "days past valid_until a host keeps the extension running while renewing (default 7)" }
      }
    },

    "targets": {
      "type": "array",
      "minItems": 1,
      "items": {
        "type": "object",
        "required": ["runtime", "delivery", "lifecycle"],
        "additionalProperties": true,
        "properties": {
          "runtime": { "type": "string", "pattern": "^[a-z][a-z0-9-]*(\\.[a-z][a-z0-9-]*)*$", "description": "posix | a registered runtime id | reverse-DNS id" },
          "runtime_version": { "$ref": "#/$defs/versionRange" },
          "platforms": { "type": "array", "items": { "type": "string", "pattern": "^[a-z0-9]+/[a-z0-9]+$" } },
          "enforcement": { "type": "string", "enum": ["declared", "advisory", "enforced"] },
          "delivery": {
            "type": "object",
            "required": ["method"],
            "additionalProperties": true,
            "properties": {
              "method": { "type": "string" },
              "auth": {
                "type": "object",
                "required": ["scheme"],
                "description": "How the host authenticates the artifact fetch (SPEC 14.4). scheme entitlement = the artifact is released only against a presented entitlement (needs a commerce block); an unknown scheme is ignored (2.4).",
                "properties": { "scheme": { "type": "string" } }
              }
            },
            "allOf": [
              {
                "if": { "properties": { "method": { "const": "archive" } } },
                "then": {
                  "required": ["url", "sha256"],
                  "properties": {
                    "url": { "$ref": "#/$defs/httpsUrl" },
                    "sha256": { "$ref": "#/$defs/sha256" },
                    "format": { "type": "string", "enum": ["tar.gz", "zip"] }
                  }
                }
              },
              {
                "if": { "properties": { "method": { "const": "hermes-integration" } } },
                "then": {
                  "required": ["install_url", "install_sha256", "uninstall_command"],
                  "properties": {
                    "install_url": { "$ref": "#/$defs/httpsUrl" },
                    "install_sha256": { "$ref": "#/$defs/sha256" },
                    "uninstall_command": { "type": "string" },
                    "requires_oauth": { "anyOf": [{ "type": "null" }, { "type": "string" }] }
                  }
                }
              }
            ]
          },
          "lifecycle": {
            "type": "object",
            "description": "Closed hook vocabulary (SPEC §2.4). Unknown keys, including namespaced keys, are rejected. Declaring enable or disable requires a 0.5-capable host; older reference validators and schemas reject them.",
            "required": ["install", "uninstall"],
            "additionalProperties": false,
            "properties": {
              "install": { "$ref": "#/$defs/relPath" },
              "upgrade": { "$ref": "#/$defs/relPath" },
              "uninstall": { "$ref": "#/$defs/relPath" },
              "health": { "$ref": "#/$defs/relPath" },
              "enable": { "$ref": "#/$defs/relPath" },
              "disable": { "$ref": "#/$defs/relPath" }
            }
          },
          "component_map": {
            "type": "object",
            "additionalProperties": { "oneOf": [{ "type": "string" }, { "type": "object" }] }
          }
        }
      }
    }
  }
}
