{
  "spec_version": "0.4",
  "kind": "agent-extension",
  "identity": {
    "publisher": "ext.example.com",
    "name": "sample-memory",
    "version": "0.3.0",
    "display_name": "Sample Memory",
    "description": "A worked example: temporal knowledge-graph memory behind an MCP server, with a daemon, a skill, a prompt fragment and a nightly job.",
    "author": "Example Org",
    "license": "MIT",
    "homepage": "https://ext.example.com/sample-memory",
    "keywords": [
      "memory",
      "knowledge-graph",
      "mcp"
    ]
  },
  "provides": {
    "mcp_servers": [
      {
        "name": "sample-memory",
        "transport": "stdio",
        "summary": "memory_write / memory_query over MCP",
        "command_ref": "bin/sample-memory-mcp"
      }
    ],
    "services": [
      {
        "name": "falkordb",
        "kind": "daemon",
        "summary": "FalkorDB graph store",
        "endpoint": "tcp://127.0.0.1:6379"
      }
    ],
    "memory": [
      {
        "name": "graph",
        "kind": "graph",
        "summary": "temporal knowledge graph",
        "schema_ref": "schemas/graph.md"
      }
    ],
    "tools": [
      {
        "name": "memory_write",
        "summary": "add a fact / edge to the graph",
        "input_schema_ref": "schemas/memory_write.json"
      },
      {
        "name": "memory_query",
        "summary": "graph / temporal query over stored facts",
        "input_schema_ref": "schemas/memory_query.json"
      }
    ],
    "skills": [
      {
        "name": "sample-memory",
        "summary": "how to store and query graph memory",
        "path": "skills/sample-memory/"
      }
    ],
    "prompts": [
      {
        "name": "sample-memory",
        "fragment_ref": "prompts/sample-memory.md"
      }
    ],
    "cron": [
      {
        "name": "nightly-compaction",
        "schedule": "0 4 * * *",
        "summary": "prune and compact stale edges"
      }
    ],
    "config": {
      "schema_ref": "schemas/config.schema.json",
      "secrets": [
        "FALKOR_PASSWORD"
      ]
    }
  },
  "requires": {
    "resources": {
      "disk_mb": 250,
      "ram_mb": 200
    },
    "commands": [
      "docker"
    ]
  },
  "permissions": {
    "network_egress": [
      "registry-1.docker.io:443",
      "auth.docker.io:443",
      "production.cloudflare.docker.com:443"
    ],
    "network_ingress": [
      "127.0.0.1:6379/tcp"
    ],
    "filesystem": [
      "state:rw",
      "system:rw"
    ],
    "secrets": [
      "FALKOR_PASSWORD"
    ],
    "root": true,
    "reason": {
      "root": "installs a systemd unit and a docker container for FalkorDB",
      "network_egress": "pulls the falkordb/falkordb image from Docker Hub",
      "network_ingress": "FalkorDB listens on loopback only"
    }
  },
  "release": {
    "channel": "stable",
    "published_at": "2026-08-27T09:00:00Z",
    "valid_until": "2027-02-23T09:00:00Z",
    "changelog": "https://ext.example.com/sample-memory/CHANGELOG.md#0-3-0",
    "artifact": {
      "url": "https://ext.example.com/sample-memory-0.3.0.tar.gz",
      "sha256": "0000000000000000000000000000000000000000000000000000000000000000"
    }
  },
  "updates": {
    "source": {
      "kind": "github",
      "repo": "example-org/sample-memory"
    },
    "check": "daily",
    "policy": "notify"
  },
  "signing": {
    "public_key": "ed25519:4KMOmBkg4PJbGclJHEsthLEOuQyyNyckkr5qraEqglE=",
    "key_id": "sample-memory-2026",
    "next_key": null
  },
  "targets": [
    {
      "runtime": "posix",
      "platforms": [
        "linux/amd64",
        "linux/arm64"
      ],
      "enforcement": "declared",
      "delivery": {
        "method": "archive",
        "url": "https://ext.example.com/sample-memory-0.3.0.tar.gz",
        "sha256": "0000000000000000000000000000000000000000000000000000000000000000"
      },
      "lifecycle": {
        "install": "install.sh",
        "upgrade": "upgrade.sh",
        "uninstall": "uninstall.sh",
        "health": "healthcheck.sh"
      },
      "component_map": {
        "mcp_servers": {
          "command": [
            "bin/sample-memory-mcp"
          ],
          "register": "auto"
        },
        "services": {
          "unit": "systemd:falkordb-samplemem.service",
          "actions": [
            "daemon-reload",
            "enable",
            "start"
          ],
          "restart": "on-failure",
          "health": "redis-cli -p 6379 ping"
        },
        "cron": {
          "unit": "systemd:samplemem-compaction.timer",
          "schedule": "0 4 * * *"
        }
      }
    },
    {
      "runtime": "hermes",
      "runtime_version": ">=0.18",
      "platforms": [
        "linux/amd64",
        "linux/arm64"
      ],
      "enforcement": "advisory",
      "delivery": {
        "method": "archive",
        "url": "https://ext.example.com/sample-memory-0.3.0-hermes.tar.gz",
        "sha256": "0000000000000000000000000000000000000000000000000000000000000000"
      },
      "lifecycle": {
        "install": "install.sh",
        "upgrade": "upgrade.sh",
        "uninstall": "uninstall.sh",
        "health": "healthcheck.sh"
      },
      "component_map": {
        "skills": {
          "dir": "skills/",
          "link": "symlink"
        },
        "tools": {
          "module": "plugins/sample_memory/",
          "register": "plugins/sample_memory/__init__.py"
        },
        "mcp_servers": {
          "command": [
            "bin/sample-memory-mcp"
          ],
          "register": "auto"
        },
        "services": {
          "unit": "systemd:falkordb-samplemem.service",
          "actions": [
            "daemon-reload",
            "enable",
            "start"
          ],
          "restart": "on-failure",
          "health": "redis-cli -p 6379 ping"
        },
        "cron": {
          "unit": "systemd:samplemem-compaction.timer",
          "schedule": "0 4 * * *"
        }
      }
    },
    {
      "runtime": "claude-code",
      "enforcement": "declared",
      "delivery": {
        "method": "archive",
        "url": "https://ext.example.com/sample-memory-0.3.0.tar.gz",
        "sha256": "0000000000000000000000000000000000000000000000000000000000000000"
      },
      "lifecycle": {
        "install": "install.sh",
        "uninstall": "uninstall.sh",
        "health": "healthcheck.sh"
      },
      "component_map": {
        "mcp_servers": {
          "command": [
            "bin/sample-memory-mcp"
          ],
          "register": "auto"
        }
      }
    }
  ],
  "signature": "Lgl3St/6cmLWqNTpundgpxGhZuElkqnZrQ7BmXyrGQPG23BIXvSH1viIz2WCeZzz/PUjl2GZbtpoWVsdlHuMDA=="
}
